ID,性别,喜欢,时间,回复,评论
路途遥望,保密,12,2018-08-29 19:25:28,0,听这个bgm，你会发现许多可以体现中国文化的纯音乐也很有魅力
辰玄轩,男,14,2018-08-14 09:42:53,1,开局一件人头壶，后面全靠编。
账号已注销,男,0,2018-08-15 20:31:05,0,6666
下野紘痴汉协会,男,14,2018-07-14 11:17:07,2,"弹幕真的……
我一直很喜欢看弹幕玩梗来着，但这时候玩梗不觉得不合适吗？这种时候玩梗无异于在别人唱国歌的时候说笑，是年度弱智行为，又没品又没家教"
烈火清华北平原,男,1,2018-07-22 22:01:42,0,本身这个纪录片也是努力想把文物变有趣啊，虽然是文物也没必要这么严肃吧，逛个博物馆还要不苟言笑肃然起敬吗？
下野紘痴汉协会,男,0,2018-07-22 22:37:24,0,回复 @烈火清华北平原 :不，你是没见到那些弹幕，完全就是恶意无礼貌无教养无内涵的灌水ky弹幕
HCl_,女,11,2018-08-16 20:40:13,0,陶鹰鼎太可爱了哈哈哈哈哈哈哈 尝试设计对白——陶鹰鼎：我超凶的！嗷呜——
行者Rambler,男,11,2018-08-03 21:44:19,1,虽然我是很喜欢这档纪录片，但是第一次看到的时候还是下意识的以为是熊猫在说话
酱鱼汤,男,0,2018-08-03 23:48:57,0,2333都是国宝（￣▽￣）
肥肉byebye,保密,11,2018-08-03 07:46:00,0,我刚看了关于这个的推文，想着找找看打开哔哩哔哩首页就给我推荐这个，这么巧？？？
小丰子2333,保密,11,2018-08-02 10:38:43,0,"当时的制造者“呜呜啊啊啊嗯啊啊！哈哈哈哈哈哈！”现在的人物“这件物品纪念着人类孕育的最初痛楚”如果真是这种情况也挺有趣的23333"
終身編號9527,保密,11,2018-07-24 00:09:51,2,"如果国宝会说话
熊猫:兽人永不为奴！喵，呸……吼！！！"
狐狸不跟,保密,1,2018-07-24 07:58:27,0,王境泽警告
龘靐齉齾麤龖龗鱻,保密,1,2018-07-24 07:27:04,0,劳动真棒
Rump-Thump,保密,11,2018-02-03 23:55:59,0,如果央视爸爸能把这些纪录片啊综艺啊加上英文字幕放到油管上就更好了
芝士小鱼干,保密,11,2018-01-15 00:00:04,0,中华最早的道是心，器物有了名字就不再是器物，土地有了信仰就不只是土地，而经历漫长时间的就拥有了时间，存在的坚定即是道而道有道不同却有同样的狭隘，诉说是从未停止的只是是否去倾听
西门哈密瓜,保密,11,2018-01-10 19:33:14,0,虽然伦家4好几千岁了，谁还不是个宝宝咋滴⊙∀⊙？
花叶无名指环,保密,11,2018-01-08 10:37:24,0,以后我们是不是可以diss流量星们“演技连文物都不如”了？
智慧的蓝色,男,11,2018-01-06 19:41:05,0,大风泱泱，大潮滂滂。洪水图腾蛟龙，烈火涅槃凤凰。文明圣火，千古未绝者，唯我无双，和天地并存，与日月同光。
域名丢失,保密,11,2018-01-03 19:49:57,4,请问各位大佬有没有开头那句“你有一条来自国宝的留言，请查收”的音频，求做短信铃声[小电视_太太喜欢]
域名丢失,保密,0,2018-01-04 18:01:25,0,回复 @苏默言: 河蟹好猛，不过还是谢啦。我试着自己截一下好了，手残伤不起_(:3」∠)_
云树海棠雨,保密,0,2018-01-04 12:18:19,0,河蟹掉了Σ( ￣□￣||)
云树海棠雨,保密,0,2018-01-04 12:17:21,0,*************************/s/1skY9N57 密码：qqd8   这里截了一个
Brian和Justin,保密,11,2018-01-03 10:57:36,0,大家顶我上去，让央视爸爸看到。求英文字幕，求文物周边!
月隹,保密,11,2018-01-03 03:03:09,7,我我我我要卖安利！国博有周边tb店！叫国博衍艺！玉龙（c形黑色那个~），还有玉凤都有出项链！我的玉龙都戴一年多了，超好看的！！～(￣▽￣～)好多博物馆都有官方店了~剁手停不下来
旺仔一定要瘦到90斤啊,保密,0,2018-01-05 19:08:42,0,回复 @月隹:哈哈哈哈哈哈  谢谢你  我已经下单买啦
月隹,保密,0,2018-01-04 17:26:38,0,回复 @钢琴上的猫:貌似没有????它家好像老早就说准备tb店，但一直没动静，没记错在陕西数字博物馆网上，有卖文创，但全页只有一个日历一套书（￣へ￣），tb上有家店叫华夏文化创意，说自己是陕历博合作出香囊的公司卖的正品，但暂时不能确认，我就只有找到这些信息了(´･_･`)
月隹,保密,0,2018-01-04 17:17:57,0,回复 @斯大林萌萌哒:对对对，一见倾心的喜欢！现在发现又出金色款了，还有其他各种新项链新首饰，有点????想剁
GDThunderbird,保密,11,2018-01-02 20:12:50,0,如果国宝会说话，盗墓的还不tmd给吓死
SCP-2300-11钠小人,男,11,2018-01-02 02:30:32,0,"一人对齐白石的画《虾》说:
你是不是虾？

“你t.m才瞎”"
十元一斤香菜,保密,13,2018-01-22 12:30:20,8,还有刷哑舍的，这种抄袭篡改历史的你们提出来不觉得丢人？？？
秃头婶,保密,2,2018-01-22 19:38:24,0,哑舍只是艺术修改，抄袭篡改历史就不好听了，就比如《西游记》玄奘取经的故事也是抄袭吗?
十元一斤香菜,保密,1,2018-01-29 14:47:24,0,回复 @少年甘罗:谢谢你帮我说详细。还有周瑜其实死了活着的她妹妹这种东西，先不谈玄色这个抄袭惯犯，光说不尊重历史就听让人恶心的。
少年甘罗,保密,1,2018-01-29 11:08:34,0,上面说艺术修改？霍去病满口粗话、兰陵王不会打仗、朱元璋靠根蜡烛打出的天下等等都已经是不尊重历史人物的表现了，竟然还说艺术。
斜阳只送平秋远,保密,10,2018-08-02 21:29:54,0,那时风动，此时心动，遭了，我心动周期就是因为贾湖骨笛变了
霍格尼特·汀·乔德夫,男,10,2018-07-31 20:58:22,1,"见到不合适的弹幕举报就好(我就举报了几个睿智)，在这里评论是没有用的，各位
希望后来的人好好看吧，别让一些不合适的弹幕毁了这么好的纪录片(´；ω；`)"
马云的小女儿耶,男,0,2018-08-01 01:03:44,0,没错没错(=・ω・=)
AMX40小黄鸭,男,10,2018-07-24 20:56:09,0,莫名想到《哑舍》（￣▽￣）
我干了啥,女,10,2018-07-24 15:46:21,0,我觉得弹幕有点过分了，各种开玩笑，不带一点尊重的。
汪叽汪叽嗷呜嗷呜,保密,10,2018-07-24 12:01:06,0,村落成了国！符号成了诗！呼唤成了歌！当仰望成为历史🤫🤫我们来听一听国宝说的话
尔风不是精分,保密,10,2018-03-06 14:35:00,0,文案真的超级超级超级棒，我要找个机会抽空全部抄下来
TardisNS,男,10,2018-01-25 23:04:40,1,"会不会是祭器(=・ω・=)


故去的人归土，我用世间的水。化作泪水，从口眼流出，流到你身上，来倾诉我对你的思念(｡･ω･｡)"
TardisNS,男,2,2018-01-25 23:06:58,0,壶肩膀处的缺口我们是不是可以猜想这是先民原本想做一套上身的，结果发现太丑了....._(:3」∠)_
半生蝉夏,男,10,2018-01-16 00:22:19,0,央视爸爸教做人（￣▽￣）
片羽吉光,女,10,2018-01-15 19:48:53,0,村落成了国，符号成了诗，呼唤成了歌。
RainbowZXY,女,10,2018-01-05 21:51:04,2,我求求各位放过哑舍吧，它只是一本书而已，别把它变成下一个ky常用词
林恩_Lynnsky,女,0,2018-01-10 12:48:14,0,看见一个举报一个
林恩_Lynnsky,女,0,2018-01-10 12:47:39,0,现在已经是了(笑)
不是方的圆,保密,10,2018-01-05 13:08:03,0,国宝留言：我！国宝！打钱！[蛆音娘_滑稽]
路人有名,女,10,2018-01-03 13:14:09,1,还以为是给文物配音……我还挺期待矛和盾的对骂的????????????
路人有名,女,0,2018-01-03 13:53:15,0,(°∀°)ﾉ
喜欢龙牙的无眠,保密,10,2018-01-02 20:12:31,0,各位能不刷了吗？现在一看见“哑舍”两个字就反胃[小电视_发愁]
点我作甚,保密,10,2020-03-20 13:54:31,1,b站这弹幕真是。。。。还有说强行解读的？你也不看看这是谁家纪录片，央视记录片的文案水平，轮得到一帮问“这东西有什么用”的小学生来质疑???
今天的画风是_,保密,0,2020-03-21 11:26:04,0,可以拉黑一下……有时候拉黑一个整个弹幕都会好看很多[doge]
Bili_276238255,保密,12,2018-07-31 22:32:48,0,希望能把中国的国宝拍成3D动漫！或者是哑舍类型的！若能看到，此生无憾！！！支持的顶我[小电视_赞]
虚拟大魔忘,保密,12,2018-07-28 22:24:15,1,我有一个脑洞诶，会不会真的有龙，只是长的不太像，后来没有了，但是先人留下的美好寓意让后人根据想象，口口相传的描述，以及先人留下有关龙的东西而创造出来的。总结就是说最早的龙是才是写实，后边是发挥想象创造的。（固有思维让我觉得部落时期的东西都很抽象，但是想一想又觉得，那个时候应该才是最写实的，因为他们的思维还没有后来那么开阔）
山洞妖,保密,0,2018-08-01 22:52:47,0,emmmm远古时期的龙就是各种生物组合起来的呀（早期人类的创造力
马猴烧酒丶小缘,保密,14,2018-01-18 10:52:01,2,人头壶内心：我就是随手被捏出来，并没有这么多意义，你们想太多了[芮小凸小凹_怀疑]
酸不溜秋酱,保密,0,2018-01-18 23:10:37,0,哈哈哈哈哈哈哈你个戏精
香蕉链球菌,保密,0,2018-01-18 12:36:25,0,我就是随手用边角料捏个玩玩。。(▔□▔)/
にまび_,保密,9,2018-08-04 14:18:18,0,有些弹幕真的不知道什么叫尊重吗
要做六级大佬的人,女,9,2018-06-09 20:17:18,0,看了这个…呃…我们说中华文化上下五千年是不是有点谦虚了（￣▽￣）
向sans势力低头,保密,9,2018-03-27 19:16:17,0,只有我觉得人头壶参考的是小孩子的形象么.....好吧应该只有我o(╥﹏╥)o
子车青鸟,女,9,2018-02-18 10:13:55,1,一月最强番
进山君Zzz,女,0,2018-02-20 19:32:39,0,一月霸权，撞飞某紫。
土豆泥拌飯,男,9,2018-02-15 00:09:22,0,第一次看时，纪录频道是以类似广告的形式播放的。当时就被惊艳到了！短短的一段纪录片美得让人窒息！
清明洛雨,男,9,2018-01-29 12:53:41,0,瞬间想到哑舍
Newest,保密,9,2018-01-13 18:01:19,0,千百年以后   宅男博物馆  展厅内的一件文物导游正在介绍它：“这是千年以前宅男用的纸巾。我们用现代技术让它说话。”   纸巾：“我是人类手中唯一幸存的一张纸巾，我的同伴……他们……他们都被涂上白漆扔到厕所洗去了´；ω；`。”
雪莲刀,保密,9,2018-01-12 13:45:39,0,18年新词：肌肉萌 诞生！！！
谁说香菜好吃的,保密,9,2018-01-10 21:22:03,0,国家特许我成精的欧（￣▽￣）
十号日天,保密,9,2018-01-08 19:04:36,0,emm，最近不是有个新闻说博物馆有不明光团嘛？莫不是远古器灵觉醒了？
理世lishi,保密,9,2018-01-05 16:47:47,0,如果国宝会说话，不会的，建国后不准成精。
沐珂塔,女,9,2018-01-04 20:13:17,0,古人对于世界的思考要比我们多，所以也并不是随便瞎捏捏的。说阅读理解的，多思考一下。
薄荷糖雪球,女,9,2018-01-04 18:32:59,0,别再说什么随便一捏随便一画了，这个梗玩多了还挺无聊的，明明知道各种礼器上的图文是具有丰富内涵的。。。
万山狐影,保密,9,2018-01-03 00:09:57,0,这个泡面番有点过瘾
焦饭饭,保密,9,2018-01-02 09:03:14,2,我讲课的时候说这壶是古人用来装粮食的，感觉被教案骗了。现在专家编写的教案越来越乱七八糟，欺负我读书少，但我也不想给我的学生乱讲
思君酒,保密,2,2018-01-02 11:51:40,0,( &#39;-&#39; )ノ)`-&#39; )历史类的都是各有各的说法，毕竟那么久远，只能说哪个说法最站得稳，最靠近真相，而且一个说法前两年可能是这样，后来又发现了新的资料，那就被推翻了。探寻古人就是这样嘛（（ｏ-ω-）♡（－ω-ｏ））
焦饭饭,保密,0,2018-01-02 22:07:44,0,唉╯▂╰好像和色就跟古人写诗一样，可能明明没呢么多意思硬被后人YY出来
霁行淵,女,9,2018-01-01 23:51:18,2,´_&gt;`哑舍粉再这样ky下去，可以路转黑了[小电视_无语]
春日二一三,女,2,2018-01-02 11:01:34,0,是的，而且哑舍还涉及抄袭……看他们疯狂刷哑舍就很尴尬了，不尊重节目
霁行淵,女,1,2018-01-02 12:55:24,0,回复 @水墨使君:是的，本来涉嫌抄袭我就很烦了
萧瑶吖,保密,9,2018-12-10 21:21:58,0,我觉得这个可以和国家宝藏媲美了，为何播放量如此低？旁白声音真的很好听，听起来也不枯燥乏味，也不像那种一般广播腔，有感情，听了也不让文科生想睡_(:3」∠)_。真的希望播放量能到一千万
官方认证胡总夫人,女,11,2018-08-11 21:43:33,0,陶鹰鼎：胖胖腿，萌萌哒，肌肉萌。滑稽(๑˙ー˙๑)陶鹰鼎：我不要面子的啊！(๑˙ー˙๑)
等在心动月台,保密,11,2018-02-11 09:49:01,2,我觉得这个比国家宝藏好看多了，那个看得我好尴尬......
等在心动月台,保密,0,2018-02-19 16:53:35,0,回复 @竹韵-幽丽:哈哈哈哈我是吃网红安利过来的
安吱吱今天努力了吗,保密,0,2018-02-19 15:35:29,0,绝对是历史老师安利过来的，因为我们也是让看这两部QAQ
黑茶の咩,男,11,2018-02-03 19:17:51,2,"央视良心节目。。。
是不是只有我一个人莫名想起了哑舍"
阿泽昂泽,男,0,2018-02-15 20:15:33,0,不是哦~
儒雅随和王二小,男,0,2018-02-14 16:25:24,0,是，只有你
秋雪Cross,女,16,2018-07-29 19:06:50,0,国宝会说话什么的马上想到了玄色姐的《哑舍》呢（￣▽￣）
lucayamasaki季節桑,保密,8,2018-08-06 21:53:02,0,只有我觉得人头壶很可爱嘛？每一集左下角那可爱的人头壶的可爱表情(*´∀`)skr~
薯片与芋泥可兼得,保密,8,2018-08-01 12:29:07,0,每次有诡异的bgm时我都想起小时候被恐怖片吓到的绝望( ´_ゝ｀)
宋星杳,女,8,2018-08-01 12:24:08,0,我在B站学历史
coreantal,保密,8,2018-07-29 10:05:33,0,村落成了国，符号成了诗，呼唤成了歌
呱呱呱大炮,保密,8,2018-07-24 16:45:03,0,我觉得国宝是会说话的，每次去博物馆看都觉得能透过他们看到遥不可及的过去，美到让人哭泣
伊酒得九,女,8,2018-05-19 22:11:49,0,被北京西城一模议论文圈过来看的我...
_骤雨,保密,8,2018-05-16 08:22:16,0,那时风动，此时心动。
你必遭天谴Nbztq,保密,8,2018-03-01 20:37:48,1,有个地方我觉得需要补充说明一下，贾湖骨笛虽然称笛但是形制上归属于“龠”类乐器，和我们现在说的横笛类的“笛”不同(｀・ω・´)
肚腩帮主常饿哥,保密,0,2018-03-04 17:31:58,0,好的，普及了，多谢
一万hin,保密,8,2018-02-22 19:14:50,0,文案出书吧
平果朵儿,女,8,2018-02-19 23:06:45,0,我不过随手捏了个壶，咋这么多事？
大BUBBLE呀,保密,8,2018-01-29 11:18:50,0,"央视是你的满分作文
用的语言也很好
将古代文物赋予新生，超棒的"
老四插千,男,8,2018-01-22 19:46:35,0,只有我一个人看宣传片还以为会是像博物馆奇妙夜里的复活岛巨人头像那样开口说话吗？( ´_ゝ｀)
栖宁,女,8,2018-01-21 14:00:29,2,子曰：“刚、毅、木、讷，近仁。”讷指谨言慎行。希望有些人评论能过过脑子，你没文化就多学，在这胡言乱语什么？择一事，做一生的那些研究者们还不如你个看客知识高？
叶落繁华满京城,女,1,2018-01-22 18:36:00,0,我觉得这番话话用来评论楼下那个就很好。。。
消灭月亮的城管大人,女,0,2018-02-11 23:47:19,0,踩一踩楼下的头
小凌子er,女,8,2018-01-15 12:41:29,0,看到每集开头辣么多已查收的弹幕就莫名被戳中泪点，好像是终于把自己家泱泱五千年的宝贝捧在了手心ε=ε=(ノ≧∇≦)ノ
酉时於菟,保密,8,2018-01-11 00:30:10,0,听到第二集千年前的笛声  刷的一下就哭出来了！  那个声音，太好听(｀・ω・´)
爱吃猕猴桃的齐天大圣,保密,8,2018-01-06 22:50:12,0,"村落成了國
符號成了詩
呼喚成了歌"
笑呀,女,8,2018-01-03 01:21:16,1,我还以为是国宝自己说话(つД`)，有点小失落
眼泪一红眼眶就掉下来,女,1,2018-01-03 02:35:14,0,我也以为是国宝说话
FFF团附属火系魔法师,男,8,2018-01-02 13:54:21,0,所有发哑舍的评论已全部举报
修仙の日常,保密,8,2018-01-02 09:46:10,0,我也不怕掉节操，刷哑舍等一切不相关内容的，脑壳是进了水还是门没给你彻底夹碎
少小离家老胖回,男,8,2018-01-02 00:21:47,4,"身边同龄的人都喜欢看综艺节目
，什么跑男，挑战，每次跟他们***，我都觉得看的一脸尴尬。很喜欢看这种类型的纪录片，历史片。可能是心老了，90后的年龄过着80后的生活，跟别人出去玩，抽烟不会，喝酒很少，打牌不会，k歌不会，每次别人都说我，这也不会那也不会，你活着还有啥意思。。。。"
蓝签,男,1,2018-01-02 00:32:36,0,别这样想啦，b站不是有很多人也在看吗，而且看文物长知识学东西，总比打牌K歌要有用吧_(:з」∠)_抽烟喝酒本来就不是好东西呀，人是有潜意识避开让自己变得不好的东西而靠近更好的东西的本能的（x(｀・ω・´)多结交点见识广爱学习的同龄人，你可能就会发现找到了真正志同道合的朋友了，而且自己也在提升
蓝签,男,0,2018-01-02 13:16:44,0,回复 @AIぃ胖墩墩:呜啊，不过不管怎么样，不接触烟酒都是好事(｀・ω・´)小时候也有用吸烟装逼的同学拿烟给我试试，然后我没抽，只把它点燃烧了玩了，那时候虽然很小但是也莫名坚定的不碰这东西╮(￣▽￣)╭然后现在想想那时候觉得那些同学很傻，还好我没做会现在后悔的事
少小离家老胖回,男,0,2018-01-02 02:22:10,0,回复 @蓝签:抽烟是学不会了，上初一的时候一起长大的小伙伴都开始学抽烟了，后来我也学着抽了一根，就再也不抽了。喝酒以前还行，最多的一次，过年跟堂哥去他小孩干爹那里，喝了三种白酒，加起来一瓶半，下午回来开始睡，一直睡到夜里醒来嘴都是干渴的，第二天去诊所拿的解酒药。后来脚受伤了，做了两次手术之后，喝啤酒就不行了。一两瓶就晕了，白酒还不知道。24岁190斤。远离酒这东西了。。。。
橘猫不太胖,保密,8,2018-01-01 23:05:28,0,你有一条来自国宝的留言，请查收
叶弓,保密,8,2018-11-17 21:24:15,2,"历史老师给我们放这个
右上角一看
bilibili"
叶弓,保密,0,2018-12-14 14:54:10,0,回复 @松月公子呀 :hhhh我们莫不是一个学校的
二樊QWQ,保密,0,2018-12-08 17:25:19,0,好巧，我也是，看到之后我同桌和我一起喊了句哔哩哔哩😂
SkisK刺球,男,8,2018-11-06 23:54:36,0,第一集不是过度解读，古人捏造的时候也没想那么多，但文物本身被赋予了更多意义
里欧爵士,男,8,2018-10-03 17:41:45,1,你央妈永远是你央妈
里欧爵士,男,0,2018-10-05 18:32:33,0,我是2333楼(=・ω・=)(=・ω・=)
一直等你走向我,保密,8,2018-08-22 11:11:04,0,妈耶，好好的纪录片放到b站就这么不正经。看弹幕看的笑死[狐妖_大笑]
Bobi要超好看,保密,12,2018-07-27 21:17:37,0,"关于b站APP下架整改相关：
1.7月26日到8月25日进行整改，后续由央视进行审核判决是否重新上架；
2.此次下架仅限安卓应用商店，IOS端用户和已下载的用户不影响使用；
3.为了b站能够通过后续审核，我们应停止带节奏，避免传出负面消息影响审核；停止引战行为，看见引战行为直接举报，不应掺和进去提高关注度；
4.此次下架为b站自己申请，非国家勒令，目的是为了阻止外部黑粉进一步入侵从而清理内部黑粉；
5.咱们现在一定要团结一心，不再吵架，安稳度过这一关键时期，为b站的未来加油！(๑•̀ㅂ•́)و✧！
以上复制粘贴过来的"
阿洋呦梗,女,10,2018-09-22 11:25:05,2,弹幕可以尊重一下文物吗？平时看那些死了人的不都是，无意冒犯，抱歉吗？现在看的是中国的文物！虽然这是B站，但还是请尊重一下谢谢。
AG超玩会王者荣耀梦蛆,女,4,2018-09-22 21:47:41,0,虽然说我觉得说的对，但是我觉得刷无意冒犯的真是够了，标题，封面等等都大概可以看出来内容讲的什么，非常明确的点进来刷句无意冒犯？？
三碗不过剛,女,2,2018-09-23 21:04:23,0,关了弹幕就没这么闹心了。一帮跟风的。真是够了
图图图狗,女,7,2018-08-10 10:04:29,1,"看《如果国宝会说话》这个记录片，除了感叹文案的优秀以外，还深深爱上了开头的提示音，每每听到心情就忍不住变好，所以动手剪辑了一下铃声，喜欢的亲们可以点击链接获取噢
https://pan.baidu.com/s/19bZQRkKg0ZIYcyYAcu5Qpg"
坩埚椒麻鸡,女,0,2018-08-12 15:33:49,0,大佬牛逼，已拿到
黑色甜椒,保密,7,2018-08-08 01:49:39,1,作为古都长安之人，看每一集来自陕西的文物都感到骄傲。西安真的有数不尽的博物馆与文化遗产
孙双羊,保密,0,2018-08-13 10:56:47,0,同城
阿祖卡布珈德,男,7,2018-08-06 22:23:51,0,明明一个科普番给弹幕的人才大哥们变成了搞笑番
长兵尔威利,女,7,2018-08-02 19:39:16,2,想起舌尖上的中国是怎么肥事，流口水了都～(￣▽￣～)~
09566509,女,0,2018-08-03 16:28:13,0,(･∀･)
缅因路的月亮-CheN,女,0,2018-08-03 10:13:12,0,你是魔鬼么哈哈哈
陳sander,保密,7,2018-08-01 23:45:52,0,b站可以考虑买下航拍中国，也是不错的纪录片
Y玉米吖M,保密,7,2018-07-26 19:06:00,0,你央视爸爸还是你央视爸爸
Ieicasa,保密,7,2018-07-25 22:12:26,0,男人听了沉默(´･_･`) 女人听了流泪（/TДT)/。因为国宝会说话(°∀°)ﾉ
飞呀飞hhh,女,7,2018-07-24 19:30:14,0,我以为讲熊猫呢哈哈哈
南蔡,女,7,2018-07-24 15:32:55,0,分享一个细思极恐的句子，人的大脑最重要，这是你的大脑告诉你的。
有爹有娘的小金凌,保密,7,2018-07-24 13:08:14,4,当你凝望着国宝时，国宝也在凝望你
有爹有娘的小金凌,保密,0,2018-08-09 09:08:31,0,回复 @斯诺没有灯 :道友
凤玄烨,保密,0,2018-07-25 01:26:01,0,我不是凝望国宝的人，我就是国宝【手动滑稽】
斯诺没有灯,保密,0,2018-07-24 13:39:43,0,这位道友你好💁
奇怪渡鸦,男,7,2018-07-13 19:45:28,0,第二季马上播出了，新闻联播讲了。希望不要和《舌尖上的中国》一样，猫头鹰下老母鸡:一茬不如一茬
是阿嫖啊,女,7,2018-04-08 22:38:44,0,被第二集结束时那个“那时风动，此时心动。”戳到
ルシフィル,保密,7,2018-03-01 18:03:29,3,国宝会说话大概会想念他一直相伴的主人吧（/TДT)/
ルシフィル,保密,0,2018-03-04 17:39:01,0,回复 @肚腩帮主常饿哥:emmmm确实(〜￣△￣)〜
肚腩帮主常饿哥,保密,0,2018-03-04 17:32:36,0,或许会笑道
ルシフィル,保密,0,2018-03-01 18:06:28,0,相守千百年，最终却也被迫分离
盒鹅盒鹅盒鹅,保密,7,2018-02-24 15:31:52,0,村落成了国，符号成了诗，呼唤成了歌。真心优秀o(^o^)o
杨家大煤炭,女,7,2018-02-05 22:49:40,0,这声音就是传说中的耳朵怀孕吧！
冰莲幻境,女,7,2018-01-24 19:51:03,1,《大舜》那个电视剧好容易烧出来一个蛋壳杯，然后他们说太奢侈了这样是不对的，就给砸了。我的个心肝脾肺肾啊(╯°口°)╯(┴—┴
长歌且行·问道风雨,女,0,2018-01-25 15:27:32,0,我也看了，而且是司法祖师皋陶烧的。
红衣教圣女,女,7,2018-01-14 21:37:20,0,我还在想，为什么没有追番这个功能
芳生,保密,7,2018-01-14 14:20:47,1,陶鹰鼎看着看着，突然发现它很像目前濒危的一种鸟，鹄鹦鹉。胖胖的身躯，虎头圆脑，蠢萌蠢萌的。会不会陶鹰鼎是以这个为原型呢
芳生,保密,0,2018-01-14 14:24:35,0,字打错了，是鸮(音同消)鹦鹉
潮生故,保密,7,2018-01-11 16:22:36,1,突然发现所有朝代的龙，我最喜欢远古文化的。之前在良渚文化博物馆看到一个这样类似的似蛇非蛇，似龙飞龙的玉器，一下子就被他吸引了，至今念念不忘。好像很久以前就见过(´･_･`)(´･_･`)有点悬哈哈哈哈
断眉小仙儿,保密,0,2018-01-11 16:42:33,0,也许真的有前世吧
你爱不爱一条柴呢,保密,7,2018-01-11 12:20:17,0,看到人头壶才知道原来真的是有亦笑亦哭的表情。
光影之暮,男,7,2018-01-10 13:07:56,1,红山玉龙，那个形象，不就是那兔作者贼蛇的自画像嘛！！！！！
我就爱土豆丝,男,0,2018-01-11 16:16:05,0,走，一起炖蛇羹去(⌒▽⌒)
kk550126,保密,7,2018-01-09 22:57:32,1,谁会截取片头那段“你有一条来自国宝的留言，请注意查收”的音频？
嘻呱鸭,保密,0,2018-01-12 15:29:33,0,同求啊(⌒▽⌒)
_0-Eriri-0_,男,7,2018-01-07 13:32:13,0,"如果国宝会说话

那韩国...怎么办[小电视_吃惊]"
Ordinary-,保密,7,2018-01-07 09:31:38,0,b站的弹幕低龄化越来越严重了吧，有些弹幕简直可以说是破坏心情和不尊重文物了ummm
喵疯猫,女,7,2018-01-07 06:09:58,0,"你闪着星星般的光，却不一定持久。你面向哲学的形容却难自圆其说。你说着我不懂的言语
比沉默还要坚定
你面向人潮的眼睛
表示不是商品"
热评都被狗抢了,男,7,2018-01-06 12:23:27,0,如果国宝会说话，他会说你瞅啥。然后你说，瞅你咋地。之后你就以破坏国宝的名义被逮捕了。
